{
  "engine": {
    "commit": "f76d01d54138efadae06660b81937b64f3568f76",
    "name": "tiger-engine"
  },
  "environment": {
    "cpu": "AMD Ryzen 7 5700X 8-Core Processor",
    "kernel": "Linux 7.2.5-3-omarchy x86_64",
    "rules_cli_release": "v1.2.3",
    "rustc": "rustc 1.98.1 (48a229cea 2026-09-01) (Arch Linux rust 1:1.98.1-1)"
  },
  "matchups": [
    {
      "challenger": "tiger",
      "draws": 0,
      "losses": 16,
      "mean_turns": 454.93333333333334,
      "opponent": "shapeshifter",
      "seeds": [
        1,
        2,
        3,
        4,
        5,
        6,
        7,
        8,
        9,
        10,
        11,
        12,
        13,
        14,
        15,
        16,
        17,
        18,
        19,
        20,
        21,
        22,
        23,
        24,
        25,
        26,
        27,
        28,
        29,
        30
      ],
      "win_rate": 0.4666666666666667,
      "win_rate_wilson95": [
        0.30232388907699753,
        0.638577003801267
      ],
      "wins": 14
    },
    {
      "challenger": "baseline",
      "draws": 0,
      "losses": 30,
      "mean_turns": 47.7,
      "opponent": "shapeshifter",
      "seeds": [
        1,
        2,
        3,
        4,
        5,
        6,
        7,
        8,
        9,
        10,
        11,
        12,
        13,
        14,
        15,
        16,
        17,
        18,
        19,
        20,
        21,
        22,
        23,
        24,
        25,
        26,
        27,
        28,
        29,
        30
      ],
      "win_rate": 0.0,
      "win_rate_wilson95": [
        0.0,
        0.11351339317396876
      ],
      "wins": 0
    },
    {
      "challenger": "tiger",
      "draws": 0,
      "losses": 17,
      "mean_turns": 406.1333333333333,
      "opponent": "flood",
      "seeds": [
        1,
        2,
        3,
        4,
        5,
        6,
        7,
        8,
        9,
        10,
        11,
        12,
        13,
        14,
        15,
        16,
        17,
        18,
        19,
        20,
        21,
        22,
        23,
        24,
        25,
        26,
        27,
        28,
        29,
        30
      ],
      "win_rate": 0.43333333333333335,
      "win_rate_wilson95": [
        0.2737748557646652,
        0.6080269299918639
      ],
      "wins": 13
    },
    {
      "challenger": "baseline",
      "draws": 0,
      "losses": 30,
      "mean_turns": 67.33333333333333,
      "opponent": "flood",
      "seeds": [
        1,
        2,
        3,
        4,
        5,
        6,
        7,
        8,
        9,
        10,
        11,
        12,
        13,
        14,
        15,
        16,
        17,
        18,
        19,
        20,
        21,
        22,
        23,
        24,
        25,
        26,
        27,
        28,
        29,
        30
      ],
      "win_rate": 0.0,
      "win_rate_wilson95": [
        0.0,
        0.11351339317396876
      ],
      "wins": 0
    }
  ],
  "schema_version": "1.0.0"
}
